{
  "resource_id": "local-ollama",
  "availability": "available",
  "quota": null,
  "rate_limits": null,
  "free_allowance": null,
  "current_usage": null,
  "billing_period": null,
  "hard_spend_ceiling": 0,
  "pricing_ref": null,
  "cooldown": null,
  "authentication_readiness": true,
  "last_verification": "2026-09-14T00:00:00-04:00"
}
